{
  "title": "SQL-Abfrage zur Datenbankanalyse",
  "topic": "Datenbanken",
  "points_total": 15,
  "task": "Schreiben Sie eine SQL-Abfrage, die alle Kunden aus einer Tabelle 'kunden' mit dem Nachnamen 'Müller' und einem Alter über 30 ausgibt. Die Ergebnisse sollen nach dem Vor- und Nachnamen sortiert werden."
}