{
  "title": "Schwierige Aufgabe zu den Verbundsoperatoren",
  "topic": "Datenbanken",
  "points_total": 20,
  "task": "Erkläre den Unterschied zwischen INNER JOIN und FULL OUTER JOIN anhand eines Beispiels mit drei Tabellen. Zeige, welche Zeilen in jedem Fall zurückgegeben werden und wann welcher Operator sinnvoll ist."
}