{
  "title": "SQL-Abfrage zur Datenbankanalyse",
  "topic": "Datenbanken",
  "points_total": 15,
  "task": "Schreiben Sie eine SQL-Abfrage, die die durchschnittliche Bewertung aller Produkte in einer Tabelle 'Produkte' berechnet, die nach dem 01.01.2023 hinzugefügt wurden. Berücksichtigen Sie nur Produkte mit mindestens 5 Bewertungen."
}