{
  "title": "Erinnerungsmechanismen im Gehirn",
  "topic": "Neurowissenschaften",
  "points_total": 20,
  "task": "Erläutern Sie die Rolle des Hippocampus bei der Bildung von Langzeitgedächtnis und diskutieren Sie, wie neuroplastische Prozesse die Erinnerungsfähigkeit beeinflussen. Gehen Sie dabei auf die Unterschiede zwischen explizitem und implizitem Gedächtnis ein."
}