{
  "title": "Aufbau und Funktion von Zellen",
  "topic": "Biologie - Zellbiologie",
  "points_total": 15,
  "task": "Beschreiben Sie den grundlegenden Aufbau einer tierischen Zelle und erklären Sie die Funktionen der Zellmembran, des Zellkerns und der Mitochondrien. Erläutern Sie zudem, wie die Zellatmung in den Mitochondrien abläuft."
}