{
  "title": "Genetische Vererbung und Mutation",
  "topic": "Biologie - Genetik",
  "points_total": 20,
  "task": "Erläutern Sie die Unterschiede zwischen homologer Rekombination und nicht-homologer Endverknüpfung (NHEJ) bei der DNA-Reparatur. Diskutieren Sie die Konsequenzen beider Prozesse für die genetische Vielfalt und die Entstehung von Mutationen."
}