{
  "title": "Evolutionäre Mechanismen und ihre Auswirkungen",
  "topic": "Biologie",
  "points_total": 20,
  "task": "Erläutern Sie die Rolle von Mutationen, genetischer Drift und natürlicher Selektion bei der Entstehung neuer Arten. Gehen Sie dabei auf die Unterschiede zwischen allopatrischer und sympatrischer Artbildung ein und diskutieren Sie, welche Faktoren die Geschwindigkeit der Artbildung beeinflussen können."
}